{
  "$schema": "https://json-schema.org/draft/2020-12/schema",
  "$id": "https://schemas.asharia.dev/package-runtime/installable-package-v2.schema.json",
  "title": "Asharia Installable Capability Package Manifest v2",
  "description": "Portable author contract for one installable Asharia capability package.",
  "type": "object",
  "additionalProperties": false,
  "required": [
    "schemaVersion",
    "packageKind",
    "id",
    "version",
    "displayName",
    "description",
    "catalogType",
    "engineApi",
    "dependencies",
    "options",
    "modules",
    "entryModules",
    "contentRoots",
    "contributions"
  ],
  "properties": {
    "schemaVersion": {
      "const": 2
    },
    "packageKind": {
      "const": "installable-capability"
    },
    "id": {
      "$ref": "package-contract-common-v1.schema.json#/$defs/packageId"
    },
    "version": {
      "$ref": "package-contract-common-v1.schema.json#/$defs/semanticVersion"
    },
    "displayName": {
      "type": "string",
      "minLength": 1,
      "maxLength": 120
    },
    "description": {
      "type": "string",
      "minLength": 1,
      "maxLength": 500
    },
    "catalogType": {
      "enum": [
        "system",
        "feature",
        "integration",
        "content",
        "template"
      ]
    },
    "engineApi": {
      "$ref": "package-contract-common-v1.schema.json#/$defs/versionConstraint"
    },
    "dependencies": {
      "type": "array",
      "items": {
        "$ref": "#/$defs/dependency"
      }
    },
    "options": {
      "type": "array",
      "items": {
        "$ref": "#/$defs/option"
      }
    },
    "modules": {
      "type": "array",
      "items": {
        "$ref": "#/$defs/module"
      }
    },
    "entryModules": {
      "$ref": "#/$defs/entryModules"
    },
    "contentRoots": {
      "type": "array",
      "items": {
        "$ref": "#/$defs/contentRoot"
      }
    },
    "contributions": {
      "type": "array",
      "items": {
        "$ref": "#/$defs/contribution"
      }
    }
  },
  "$defs": {
    "hostKind": {
      "$ref": "package-contract-common-v1.schema.json#/$defs/hostKind"
    },
    "platformId": {
      "$ref": "package-contract-common-v1.schema.json#/$defs/platformId"
    },
    "platformList": {
      "type": "array",
      "minItems": 1,
      "uniqueItems": true,
      "items": {
        "$ref": "#/$defs/platformId"
      }
    },
    "shippingClass": {
      "$ref": "package-contract-common-v1.schema.json#/$defs/shippingClass"
    },
    "dependency": {
      "type": "object",
      "additionalProperties": false,
      "required": [
        "id",
        "version"
      ],
      "properties": {
        "id": {
          "$ref": "package-contract-common-v1.schema.json#/$defs/packageId"
        },
        "version": {
          "$ref": "package-contract-common-v1.schema.json#/$defs/versionConstraint"
        }
      }
    },
    "optionBase": {
      "type": "object",
      "required": [
        "id",
        "type",
        "default",
        "affects"
      ],
      "properties": {
        "id": {
          "$ref": "package-contract-common-v1.schema.json#/$defs/localId"
        },
        "affects": {
          "type": "array",
          "minItems": 1,
          "uniqueItems": true,
          "items": {
            "enum": [
              "build",
              "activation",
              "cook"
            ]
          }
        }
      }
    },
    "booleanOption": {
      "type": "object",
      "required": [
        "type",
        "default"
      ],
      "properties": {
        "type": {
          "const": "boolean"
        },
        "default": {
          "type": "boolean"
        }
      }
    },
    "integerOption": {
      "type": "object",
      "required": [
        "type",
        "default"
      ],
      "properties": {
        "type": {
          "const": "integer"
        },
        "default": {
          "type": "integer"
        },
        "minimum": {
          "type": "integer"
        },
        "maximum": {
          "type": "integer"
        }
      }
    },
    "stringOption": {
      "type": "object",
      "required": [
        "type",
        "default"
      ],
      "properties": {
        "type": {
          "const": "string"
        },
        "default": {
          "type": "string"
        },
        "minimumLength": {
          "type": "integer",
          "minimum": 0
        },
        "maximumLength": {
          "type": "integer",
          "minimum": 0
        }
      }
    },
    "enumOption": {
      "type": "object",
      "required": [
        "type",
        "default",
        "values"
      ],
      "properties": {
        "type": {
          "const": "enum"
        },
        "default": {
          "type": "string"
        },
        "values": {
          "type": "array",
          "minItems": 2,
          "uniqueItems": true,
          "items": {
            "type": "string",
            "minLength": 1
          }
        }
      }
    },
    "option": {
      "type": "object",
      "unevaluatedProperties": false,
      "allOf": [
        {
          "$ref": "#/$defs/optionBase"
        },
        {
          "oneOf": [
            {
              "$ref": "#/$defs/booleanOption"
            },
            {
              "$ref": "#/$defs/integerOption"
            },
            {
              "$ref": "#/$defs/stringOption"
            },
            {
              "$ref": "#/$defs/enumOption"
            }
          ]
        }
      ]
    },
    "module": {
      "type": "object",
      "additionalProperties": false,
      "required": [
        "id",
        "role",
        "dependsOn",
        "hostKinds",
        "platforms",
        "shippingClass",
        "requiredCapabilities"
      ],
      "properties": {
        "id": {
          "$ref": "package-contract-common-v1.schema.json#/$defs/localId"
        },
        "role": {
          "$ref": "package-contract-common-v1.schema.json#/$defs/moduleRole"
        },
        "dependsOn": {
          "type": "array",
          "uniqueItems": true,
          "items": {
            "$ref": "package-contract-common-v1.schema.json#/$defs/localId"
          }
        },
        "hostKinds": {
          "type": "array",
          "minItems": 1,
          "uniqueItems": true,
          "items": {
            "$ref": "#/$defs/hostKind"
          }
        },
        "platforms": {
          "$ref": "#/$defs/platformList"
        },
        "shippingClass": {
          "$ref": "#/$defs/shippingClass"
        },
        "requiredCapabilities": {
          "type": "array",
          "uniqueItems": true,
          "items": {
            "$ref": "package-contract-common-v1.schema.json#/$defs/packageId"
          }
        }
      }
    },
    "moduleReferenceList": {
      "type": "array",
      "minItems": 1,
      "uniqueItems": true,
      "items": {
        "$ref": "package-contract-common-v1.schema.json#/$defs/localId"
      }
    },
    "entryModules": {
      "type": "object",
      "additionalProperties": false,
      "properties": {
        "runtime": {
          "$ref": "#/$defs/moduleReferenceList"
        },
        "authoring": {
          "$ref": "#/$defs/moduleReferenceList"
        },
        "cook": {
          "$ref": "#/$defs/moduleReferenceList"
        },
        "diagnostics": {
          "$ref": "#/$defs/moduleReferenceList"
        }
      }
    },
    "contentRoot": {
      "type": "object",
      "additionalProperties": false,
      "required": [
        "id",
        "path",
        "role",
        "platforms",
        "shippingClass"
      ],
      "properties": {
        "id": {
          "$ref": "package-contract-common-v1.schema.json#/$defs/localId"
        },
        "path": {
          "type": "string",
          "minLength": 1,
          "pattern": "^(?!/)(?![A-Za-z]:)(?!.*\\\\).+$"
        },
        "role": {
          "enum": [
            "runtime",
            "editor",
            "source",
            "template"
          ]
        },
        "platforms": {
          "$ref": "#/$defs/platformList"
        },
        "shippingClass": {
          "$ref": "#/$defs/shippingClass"
        }
      }
    },
    "contribution": {
      "type": "object",
      "additionalProperties": false,
      "required": [
        "id",
        "kind",
        "module",
        "hostKinds",
        "shippingClass"
      ],
      "properties": {
        "id": {
          "$ref": "package-contract-common-v1.schema.json#/$defs/packageId"
        },
        "kind": {
          "$ref": "package-contract-common-v1.schema.json#/$defs/packageId"
        },
        "module": {
          "$ref": "package-contract-common-v1.schema.json#/$defs/localId"
        },
        "hostKinds": {
          "type": "array",
          "minItems": 1,
          "uniqueItems": true,
          "items": {
            "$ref": "#/$defs/hostKind"
          }
        },
        "shippingClass": {
          "$ref": "#/$defs/shippingClass"
        }
      }
    }
  }
}
